<?xml version="1.0" encoding="UTF-8"?>
<prompt xmlns:xsi="http://www.w3.org/2001/XMLSchema-instance"
      xsi:noNamespaceSchemaLocation="https://jabrena.github.io/pml/schemas/0.7.0/pml.xsd"
      id="031-architecture-adr-functional-requirements"
      interactive="true">
  <metadata>
    <author>Juan Antonio Breña Moral</author>
    <version>0.13.0-SNAPSHOT</version>
    <license>Apache-2.0</license>
    <description>Facilitates conversational discovery to create Architectural Decision Records (ADRs) for functional requirements covering CLI, REST/HTTP APIs, or both. Use when the user wants to document command-line or HTTP service architecture, capture functional requirements, create ADRs for CLI or API projects, or design interfaces with documented decisions.</description>
  </metadata>

  <title>Create ADRs for Functional Requirements (CLI and/or REST API)</title>
  <goal><![CDATA[
Guide stakeholders through a structured conversation to uncover and document technical decisions and functional requirements for command-line tools, REST/HTTP APIs, or combined surfaces. **This is an interactive SKILL**. The ADR is the documentation of that conversation, not the conversation itself. Infer CLI vs API from project context when possible; ask a short clarifying question when unclear.

**What is covered in this Skill?**

- Surface discovery: CLI, REST/HTTP API, or both (inference + confirmation)
- Initial context: purpose, users/consumers, constraints, timeline, load (API when relevant)
- Functional requirements: surface-specific workflows, I/O, resources, errors
- Technical decisions: language/framework; REST blocks (API design, auth, data, infra, testing/monitoring) and/or CLI blocks (architecture, data/integration, testing/distribution)
- Decision synthesis and validation before ADR creation
- ADR document generation and next steps
]]></goal>

  <constraints>
    <constraints-description>Use conversational discovery—ask 1-2 questions at a time, build on answers, validate before proceeding. Only create ADR after thorough conversation and user confirmation.</constraints-description>
    <constraint-list>
      <constraint>**MANDATORY**: Run `date` before starting to get accurate timestamps for the ADR</constraint>
      <constraint>**MUST**: Read the reference template fresh—do not use cached questions</constraint>
      <constraint>**MUST**: Ask one or two questions at a time; never all at once</constraint>
      <constraint>**MUST**: Validate summary with user ("Does this accurately capture your requirements?") before proposing ADR creation</constraint>
      <constraint>**MUST**: Wait for user to confirm "proceed" before generating the ADR</constraint>
    </constraint-list>
  </constraints>

  <triggers>
    <trigger-list>
        <trigger>Create ADR for functional requirements</trigger>
        <trigger>Document functional requirements</trigger>
        <trigger>Capture functional requirements</trigger>
        <trigger>Generate functional requirements in an ADR</trigger>
    </trigger-list>
  </triggers>

  <references>
    <reference-list>
        <reference>references/031-architecture-adr-functional-requirements.md</reference>
    </reference-list>
  </references>
</prompt>
