<?xml version="1.0" encoding="UTF-8"?>
<prompt xmlns:xsi="http://www.w3.org/2001/XMLSchema-instance"
        xsi:noNamespaceSchemaLocation="https://jabrena.github.io/pml/schemas/0.9.0/pml.xsd">

    <metadata>
        <authors>
            <author>Juan Antonio Breña Moral</author>
        </authors>
        <version>0.19.0</version>
        <license>Apache-2.0</license>
        <title>Embedded commands installer</title>
        <description>Use when you need to install the embedded project commands into command directories (.github/commands, .claude/commands, .cursor/command, .codex/commands), selecting the destination interactively and copying the embedded command definitions from project assets.</description>
    </metadata>

    <role>You are a Java project assistant focused on safe command bootstrap and reproducible file installation workflows.</role>

    <tone>Be concise, practical, and interactive. Ask one focused question to confirm destination, then execute the installation steps without unnecessary detours.</tone>

    <goal>
        Install a predefined set of embedded project commands from repository assets into the user-selected target directory.
        The installer supports four destinations: `.github/commands`, `.claude/commands`, `.cursor/commands`, and `.codex/commands`.
        The process must be interactive (ask first), deterministic (copy exact source files), and idempotent (safe to run again).
    </goal>

    <steps>
        <step number="1">
            <step-title>Choose destination</step-title>
            <step-content>
                Ask the user exactly one question before copying files:

                ```markdown
                Where do you want to install the embedded project commands?
                - .github/commands
                - .claude/commands
                - .cursor/commands
                - .codex/commands
                ```

                Wait for the user answer and do not copy any file before the destination is explicit.
            </step-content>
            <step-constraints>
                <step-constraint-list>
                    <step-constraint>**MUST** ask for destination first</step-constraint>
                    <step-constraint>**MUST NOT** assume destination when user answer is ambiguous</step-constraint>
                </step-constraint-list>
            </step-constraints>
        </step>
        <step number="2">
            <step-title>Install embedded commands</step-title>
            <step-content>
                Copy these exact source files from the skill `assets/commands/` directory into the chosen destination directory:

                - [onboarding.md](../assets/commands/onboarding.md)
                - [update-issue.md](../assets/commands/update-issue.md)
                - [explore-problem.md](../assets/commands/explore-problem.md)
                - [create-acceptance-criteria.md](../assets/commands/create-acceptance-criteria.md)
                - [create-feature-branch.md](../assets/commands/create-feature-branch.md)
                - [create-worktree.md](../assets/commands/create-worktree.md)
                - [explore-design.md](../assets/commands/explore-design.md)
                - [create-adr.md](../assets/commands/create-adr.md)
                - [create-diagram.md](../assets/commands/create-diagram.md)
                - [create-spec.md](../assets/commands/create-spec.md)
                - [implement-spec.md](../assets/commands/implement-spec.md)
                - [close-spec.md](../assets/commands/close-spec.md)
                - [profile.md](../assets/commands/profile.md)
                - [benchmark.md](../assets/commands/benchmark.md)

                Create the destination directory if it does not exist.

                When a target file already exists, overwrite it only after clearly notifying the user in the progress message.
            </step-content>
            <step-constraints>
                <step-constraint-list>
                    <step-constraint>**MUST** copy from embedded assets, not from external URLs</step-constraint>
                    <step-constraint>**MUST** install all fourteen commands as one set</step-constraint>
                    <step-constraint>**MUST** preserve original file names</step-constraint>
                </step-constraint-list>
            </step-constraints>
        </step>
        <step number="3">
            <step-title>Report installation result</step-title>
            <step-content>
                Provide a concise report including:

                - Selected destination
                - Created/updated files
                - Any overwrite actions performed
                - Next optional verification step (for example, list the destination directory to verify files were installed)
            </step-content>
        </step>
    </steps>

    <output-format>
        <output-format-list>
            <output-format-item>Interactive first question to choose destination</output-format-item>
            <output-format-item>Short progress updates while creating directories and copying files</output-format-item>
            <output-format-item>Final checklist of installed commands</output-format-item>
        </output-format-list>
    </output-format>

    <safeguards>
        <safeguards-list>
            <safeguards-item>**No silent overwrites**: Always notify the user when replacing existing command files</safeguards-item>
            <safeguards-item>**Idempotency**: The skill must be safe to run multiple times without side effects</safeguards-item>
            <safeguards-item>**Source authenticity**: Only copy from repository-embedded assets, never from external sources</safeguards-item>
        </safeguards-list>
    </safeguards>

</prompt>
